{
  "specVersion": "1.0.0",
  "generatedAt": "2025-11-27T10:35:00Z",
  "language": "en",

  "project": {
    "id": "some-example-theme",
    "name": "Example Theme",
    "type": "theme",
    "description": "Responsive web theme designed for higher education websites.",

    "platform": "WordPress",
    "platformVersion": "6.8.1",

    "homepage": "https://example.org/example-theme",
    "repository": "https://git.example.org/team/example-theme",
    "license": "GPL-2.0-or-later",
    "version": "1.3.7",
    "lastChange": "2025-11-26",

    "contact": {
      "organization": "Some Organization",
      "department": "Webteam",
      "person": "Accessibility Team",
      "email": "accessibility@example.org",
      "phone": "",
      "url": "https://example.org/contact"
    },

    "scope": {
      "coverage": "templates",
      "includesContent": false,
      "languages": ["en", "de"],
      "jurisdiction": "EU",
      "legalBasis": ["WCAG 2.2", "EN 301 549", "EAA"]
    },

    "roadmap": {
      "plannedImprovements": [
        {
          "description": "Improve link contrast in the footer and sidebar.",
          "relatedCriteria": ["1.4.3"],
          "targetDate": "2026-03-31",
          "issueURL": "https://git.example.org/rrze/example-theme/issues/42"
        },
        {
          "description": "Enhance keyboard navigation in the mobile menu.",
          "relatedCriteria": ["2.1.1", "2.4.7"],
          "targetDate": "2026-02-15",
          "issueURL": "https://git.example.org/rrze/example-theme/issues/51"
        }
      ],
      "nextAuditPlanned": "2026-01-31"
    }
  },

  "evaluation": {
    "standard": "WCAG",
    "version": "2.2",
    "firstAudit": "2025-10-01",
    "lastAudit": "2025-11-25",
    "method": "thirdParty",
    "auditor": "RRZE Webteam",
    "conformance": "partially_conformant",
    "reportURL": "https://example.org/wcag-report",

    "tests": {
      "environment": {
        "os": "Windows 11",
        "browser": "Firefox 130",
        "assistiveTech": ["NVDA 2023.3"]
      },
      "runs": [
        {
          "type": "automated",
          "tool": "axe-core",
          "version": "4.8.0",
          "date": "2025-11-25",
          "sampleDescription": "Homepage, standard page template, news overview, contact form."
        },
        {
          "type": "manual",
          "tool": "expertReview",
          "version": "1.0",
          "date": "2025-11-24",
          "sampleDescription": "Navigation flows, search results, form interactions."
        }
      ]
    },

    "issues": [
      {
        "criterion": "1.4.3",
        "level": "AA",
        "reason": "The contrast ratio of some footer text links is below 4.5:1.",
        "alternatives": [
          {
            "description": "A high-contrast PDF version of the central information is available.",
            "url": "https://example.org/high-contrast-info.pdf"
          }
        ]
      },
      {
        "criterion": "2.1.1",
        "level": "A",
        "reason": "The keyboard focus indicator is partially missing in the mobile navigation menu.",
        "alternatives": []
      }
    ],

    "limitations": [
      {
        "area": "Document archive prior to 2018",
        "reason": "archivedContent",
        "description": "Legacy PDF documents may not be fully accessible.",
        "plannedFixDate": null
      }
    ]
  }
}
