{
  "specVersion": "1.0.0",
  "generatedAt": "2025-11-27T10:35:00Z",
  "language": "de",

  "project": {
    "id": "rrze-example-theme",
    "name": "WordPress Theme Example",
    "type": "theme",
    "description": "WordPress Theme Example.",

    "platform": "WordPress",
    "platformVersion": "6.8.1",

    "homepage": "https://example.org/example-theme",
    "repository": "https://git.example.org/rrze/example-theme",
    "license": "GPL-2.0-or-later",
    "version": "1.3.7",
    "lastChange": "2025-11-26",

    "contact": {
      "organization": "Example Corp",
      "department": "Webteam",
      "person": "Some One",
      "email": "some.one@example.org",
      "phone": "",
      "url": "https://www.example.org"
    },

    "scope": {
      "coverage": "templates",
      "includesContent": false,
      "languages": ["de", "en"],
      "jurisdiction": "EU-DE",
      "legalBasis": ["WCAG 2.2", "EN 301 549", "EAA"]
    },

    "roadmap": {
      "plannedImprovements": [
        {
          "description": "Überarbeitung der Linkkontraste in Footer und Sidebar.",
          "relatedCriteria": ["1.4.3"],
          "targetDate": "2026-03-31",
          "issueURL": "https://git.example.org/rrze/example-theme/issues/42"
        },
        {
          "description": "Verbesserung der Tastaturnavigation im mobilen Menü.",
          "relatedCriteria": ["2.1.1", "2.4.7"],
          "targetDate": "2026-02-15",
          "issueURL": "https://git.example.org/rrze/example-theme/issues/51"
        }
      ],
      "nextAuditPlanned": "2026-01-31"
    }
  },

  "evaluation": {
    "standard": "WCAG",
    "version": "2.2",
    "firstAudit": "2025-10-01",
    "lastAudit": "2025-11-25",
    "method": "thirdParty",
    "auditor": "RRZE Webteam",
    "conformance": "partially_conformant",
    "reportURL": "https://example.org/wcag-report",

    "tests": {
      "environment": {
        "os": "Windows 11",
        "browser": "Firefox 130",
        "assistiveTech": ["NVDA 2023.3"]
      },
      "runs": [
        {
          "type": "automated",
          "tool": "axe-core",
          "version": "4.8.0",
          "date": "2025-11-25",
          "sampleDescription": "Startseite, Standardseite, News, Kontaktformular"
        },
        {
          "type": "manual",
          "tool": "expertReview",
          "version": "1.0",
          "date": "2025-11-24",
          "sampleDescription": "Navigationspfade, Suchergebnisse, Formulare"
        }
      ]
    },

    "issues": [
      {
        "criterion": "1.4.3",
        "level": "AA",
        "reason": "Kontrastverhältnis einiger Textlinks im Footer unterschreitet 4.5:1.",
        "alternatives": [
          {
            "description": "Alternative PDF-Versionen mit hohem Kontrast für zentrale Informationsseiten.",
            "url": "https://example.org/infos-barrierefrei-pdf"
          }
        ]
      },
      {
        "criterion": "2.1.1",
        "level": "A",
        "reason": "Keyboard-Fokus in der mobilen Navigationsleiste teilweise nicht sichtbar.",
        "alternatives": []
      }
    ],

    "limitations": [
      {
        "area": "Download-Archiv vor 2018",
        "reason": "archivedContent",
        "description": "Historische PDF-Dokumente sind nur teilweise barrierefrei.",
        "plannedFixDate": null
      }
    ]
  }
}
